{
  "run_id": "bb9e4549-9a66-4d7d-a104-53fa1e07b63e",
  "graph_id": "graph-0001",
  "status": "RUNNING",
  "started_at": "2026-01-28T05:37:34.427742+00:00",
  "node_states": [
    {
      "task_id": "T0000",
      "status": "PENDING",
      "last_receipt_id": ""
    },
    {
      "task_id": "T0001",
      "status": "BLOCKED",
      "last_receipt_id": ""
    },
    {
      "task_id": "T0002",
      "status": "BLOCKED",
      "last_receipt_id": ""
    },
    {
      "task_id": "T0003",
      "status": "BLOCKED",
      "last_receipt_id": ""
    },
    {
      "task_id": "T0004",
      "status": "BLOCKED",
      "last_receipt_id": ""
    },
    {
      "task_id": "T0005",
      "status": "BLOCKED",
      "last_receipt_id": ""
    },
    {
      "task_id": "T0006",
      "status": "BLOCKED",
      "last_receipt_id": ""
    },
    {
      "task_id": "T0007",
      "status": "BLOCKED",
      "last_receipt_id": ""
    },
    {
      "task_id": "T0008",
      "status": "BLOCKED",
      "last_receipt_id": ""
    },
    {
      "task_id": "T0009",
      "status": "BLOCKED",
      "last_receipt_id": ""
    },
    {
      "task_id": "T0010",
      "status": "BLOCKED",
      "last_receipt_id": ""
    },
    {
      "task_id": "T0011",
      "status": "BLOCKED",
      "last_receipt_id": ""
    },
    {
      "task_id": "T0012",
      "status": "BLOCKED",
      "last_receipt_id": ""
    },
    {
      "task_id": "T0013",
      "status": "BLOCKED",
      "last_receipt_id": ""
    },
    {
      "task_id": "T0014",
      "status": "BLOCKED",
      "last_receipt_id": ""
    },
    {
      "task_id": "T0015",
      "status": "BLOCKED",
      "last_receipt_id": ""
    },
    {
      "task_id": "T0016",
      "status": "BLOCKED",
      "last_receipt_id": ""
    },
    {
      "task_id": "T0017",
      "status": "BLOCKED",
      "last_receipt_id": ""
    },
    {
      "task_id": "T0018",
      "status": "BLOCKED",
      "last_receipt_id": ""
    },
    {
      "task_id": "T0100",
      "status": "BLOCKED",
      "last_receipt_id": ""
    },
    {
      "task_id": "T0101",
      "status": "BLOCKED",
      "last_receipt_id": ""
    },
    {
      "task_id": "T0102",
      "status": "BLOCKED",
      "last_receipt_id": ""
    }
  ],
  "resume_cursor": {
    "last_node": "",
    "next_nodes": [
      "T0000"
    ]
  },
  "receipts": [],
  "artifacts": []
}